{
  "schemaVersion": "1.0",
  "generatedAt": "2026-10-21T17:41:31.850232013Z",
  "batchStartedAt": "2026-10-21T17:39:27.920592861Z",
  "batchCompletedAt": "2026-10-21T17:41:31.850232013Z",
  "sources": [
    {
      "sourceId": "3sbio-news",
      "sourceName": "三生制药新闻",
      "status": "ok",
      "startedAt": "2026-10-21T13:11:19.644592260Z",
      "completedAt": "2026-10-21T13:11:21.848039190Z",
      "fetchedCount": 4,
      "newCount": 4,
      "duplicateCount": 0,
      "failedCount": 0,
      "httpStatusClasses": {
        "2xx": 1
      },
      "errorCode": null,
      "nextRetryAt": null
    },
    {
      "sourceId": "abbvie-news",
      "sourceName": "AbbVie News",
      "status": "ok",
      "startedAt": "2026-10-21T13:11:20.571992553Z",
      "completedAt": "2026-10-21T13:11:20.818113318Z",
      "fetchedCount": 10,
      "newCount": 10,
      "duplicateCount": 0,
      "failedCount": 0,
      "httpStatusClasses": {
        "2xx": 1
      },
      "errorCode": null,
      "nextRetryAt": null
    },
    {
      "sourceId": "amgen-news-releases",
      "sourceName": "Amgen News Releases",
      "status": "ok",
      "startedAt": "2026-10-21T13:11:16.180010772Z",
      "completedAt": "2026-10-21T13:11:23.916460031Z",
      "fetchedCount": 20,
      "newCount": 15,
      "duplicateCount": 0,
      "failedCount": 0,
      "httpStatusClasses": {
        "2xx": 1
      },
      "errorCode": null,
      "nextRetryAt": null
    },
    {
      "sourceId": "beijing-health-policy",
      "sourceName": "Beijing Municipal Health Commission",
      "status": "ok",
      "startedAt": "2026-10-21T17:39:27.923137251Z",
      "completedAt": "2026-10-21T17:39:30.351808746Z",
      "fetchedCount": 20,
      "newCount": 20,
      "duplicateCount": 0,
      "failedCount": 0,
      "httpStatusClasses": {
        "2xx": 1
      },
      "errorCode": null,
      "nextRetryAt": null
    },
    {
      "sourceId": "bjcancer-research",
      "sourceName": "北京大学肿瘤医院科研成果",
      "status": "ok",
      "startedAt": "2026-10-21T08:50:46.636161794Z",
      "completedAt": "2026-10-21T08:50:47.720648353Z",
      "fetchedCount": 13,
      "newCount": 13,
      "duplicateCount": 0,
      "failedCount": 0,
      "httpStatusClasses": {
        "2xx": 1
      },
      "errorCode": null,
      "nextRetryAt": null
    },
    {
      "sourceId": "btch-research",
      "sourceName": "Beijing Tsinghua Changgung Hospital Research",
      "status": "ok",
      "startedAt": "2026-10-21T08:50:46.063184288Z",
      "completedAt": "2026-10-21T08:50:47.884810331Z",
      "fetchedCount": 4,
      "newCount": 4,
      "duplicateCount": 0,
      "failedCount": 0,
      "httpStatusClasses": {
        "2xx": 1
      },
      "errorCode": null,
      "nextRetryAt": null
    },
    {
      "sourceId": "cde-drug-review-updates",
      "sourceName": "NMPA Center for Drug Evaluation",
      "status": "ok",
      "startedAt": "2026-10-21T17:39:27.921907710Z",
      "completedAt": "2026-10-21T17:39:31.750537518Z",
      "fetchedCount": 20,
      "newCount": 11,
      "duplicateCount": 9,
      "failedCount": 0,
      "httpStatusClasses": {
        "2xx": 1
      },
      "errorCode": null,
      "nextRetryAt": null
    },
    {
      "sourceId": "china-cdc-news",
      "sourceName": "Chinese Center for Disease Control and Prevention",
      "status": "ok",
      "startedAt": "2026-10-21T13:46:23.520067670Z",
      "completedAt": "2026-10-21T13:46:27.765025504Z",
      "fetchedCount": 10,
      "newCount": 5,
      "duplicateCount": 5,
      "failedCount": 0,
      "httpStatusClasses": {
        "2xx": 1
      },
      "errorCode": null,
      "nextRetryAt": null
    },
    {
      "sourceId": "cleveland-clinic-news",
      "sourceName": "Cleveland Clinic Newsroom",
      "status": "ok",
      "startedAt": "2026-10-21T08:50:46.066273892Z",
      "completedAt": "2026-10-21T08:50:46.636077257Z",
      "fetchedCount": 15,
      "newCount": 15,
      "duplicateCount": 0,
      "failedCount": 0,
      "httpStatusClasses": {
        "2xx": 1
      },
      "errorCode": null,
      "nextRetryAt": null
    },
    {
      "sourceId": "clinicaltrials-recent",
      "sourceName": "ClinicalTrials.gov",
      "status": "ok",
      "startedAt": "2026-10-21T07:35:08.909379222Z",
      "completedAt": "2026-10-21T07:35:09.417408029Z",
      "fetchedCount": 20,
      "newCount": 20,
      "duplicateCount": 0,
      "failedCount": 0,
      "httpStatusClasses": {
        "2xx": 1
      },
      "errorCode": null,
      "nextRetryAt": null
    },
    {
      "sourceId": "ema-news",
      "sourceName": "European Medicines Agency",
      "status": "ok",
      "startedAt": "2026-10-21T13:46:22.488181385Z",
      "completedAt": "2026-10-21T13:46:23.367874567Z",
      "fetchedCount": 10,
      "newCount": 10,
      "duplicateCount": 0,
      "failedCount": 0,
      "httpStatusClasses": {
        "2xx": 1
      },
      "errorCode": null,
      "nextRetryAt": null
    },
    {
      "sourceId": "europe-pmc-recent",
      "sourceName": "Europe PMC",
      "status": "ok",
      "startedAt": "2026-10-21T07:35:08.909530674Z",
      "completedAt": "2026-10-21T07:35:12.054720825Z",
      "fetchedCount": 40,
      "newCount": 40,
      "duplicateCount": 0,
      "failedCount": 0,
      "httpStatusClasses": {
        "2xx": 1
      },
      "errorCode": null,
      "nextRetryAt": null
    },
    {
      "sourceId": "fda-biologics-news",
      "sourceName": "FDA Vaccines, Blood and Biologics",
      "status": "ok",
      "startedAt": "2026-10-21T13:46:22.486490002Z",
      "completedAt": "2026-10-21T13:46:23.434975339Z",
      "fetchedCount": 20,
      "newCount": 20,
      "duplicateCount": 0,
      "failedCount": 0,
      "httpStatusClasses": {
        "2xx": 1
      },
      "errorCode": null,
      "nextRetryAt": null
    },
    {
      "sourceId": "fda-drug-news",
      "sourceName": "U.S. Food and Drug Administration - Drugs",
      "status": "ok",
      "startedAt": "2026-10-21T13:46:22.482124335Z",
      "completedAt": "2026-10-21T13:46:23.428514709Z",
      "fetchedCount": 20,
      "newCount": 20,
      "duplicateCount": 0,
      "failedCount": 0,
      "httpStatusClasses": {
        "2xx": 1
      },
      "errorCode": null,
      "nextRetryAt": null
    },
    {
      "sourceId": "fda-medwatch-alerts",
      "sourceName": "FDA MedWatch Safety Alerts",
      "status": "ok",
      "startedAt": "2026-10-21T13:46:22.481771920Z",
      "completedAt": "2026-10-21T13:46:23.437419839Z",
      "fetchedCount": 20,
      "newCount": 20,
      "duplicateCount": 0,
      "failedCount": 0,
      "httpStatusClasses": {
        "2xx": 1
      },
      "errorCode": null,
      "nextRetryAt": null
    },
    {
      "sourceId": "gsk-press-releases",
      "sourceName": "GSK Press Releases",
      "status": "ok",
      "startedAt": "2026-10-21T13:11:16.182306647Z",
      "completedAt": "2026-10-21T13:11:17.866761368Z",
      "fetchedCount": 20,
      "newCount": 20,
      "duplicateCount": 0,
      "failedCount": 0,
      "httpStatusClasses": {
        "2xx": 1
      },
      "errorCode": null,
      "nextRetryAt": null
    },
    {
      "sourceId": "guangdong-health-explain",
      "sourceName": "广东省卫生健康委政策解读",
      "status": "ok",
      "startedAt": "2026-10-21T17:39:30.351896548Z",
      "completedAt": "2026-10-21T17:39:32.377606588Z",
      "fetchedCount": 20,
      "newCount": 20,
      "duplicateCount": 0,
      "failedCount": 0,
      "httpStatusClasses": {
        "2xx": 1
      },
      "errorCode": null,
      "nextRetryAt": null
    },
    {
      "sourceId": "hansoh-news",
      "sourceName": "翰森制药新闻发布",
      "status": "ok",
      "startedAt": "2026-10-21T13:11:17.640177259Z",
      "completedAt": "2026-10-21T13:11:23.360901966Z",
      "fetchedCount": 12,
      "newCount": 12,
      "duplicateCount": 0,
      "failedCount": 0,
      "httpStatusClasses": {
        "2xx": 1
      },
      "errorCode": null,
      "nextRetryAt": null
    },
    {
      "sourceId": "health-canada-health-products",
      "sourceName": "Health Canada Health Product Recalls",
      "status": "ok",
      "startedAt": "2026-10-21T13:46:23.434995328Z",
      "completedAt": "2026-10-21T13:46:23.760442992Z",
      "fetchedCount": 15,
      "newCount": 15,
      "duplicateCount": 0,
      "failedCount": 0,
      "httpStatusClasses": {
        "2xx": 1
      },
      "errorCode": null,
      "nextRetryAt": null
    },
    {
      "sourceId": "hengrui-focus-news",
      "sourceName": "Jiangsu Hengrui Pharmaceuticals Focus News",
      "status": "ok",
      "startedAt": "2026-10-21T13:11:16.946134420Z",
      "completedAt": "2026-10-21T13:11:20.571948277Z",
      "fetchedCount": 20,
      "newCount": 20,
      "duplicateCount": 0,
      "failedCount": 0,
      "httpStatusClasses": {
        "2xx": 1
      },
      "errorCode": null,
      "nextRetryAt": null
    },
    {
      "sourceId": "junshi-news",
      "sourceName": "君实生物新闻",
      "status": "ok",
      "startedAt": "2026-10-21T13:11:17.866827144Z",
      "completedAt": "2026-10-21T13:11:19.644548108Z",
      "fetchedCount": 4,
      "newCount": 4,
      "duplicateCount": 0,
      "failedCount": 0,
      "httpStatusClasses": {
        "2xx": 1
      },
      "errorCode": null,
      "nextRetryAt": null
    },
    {
      "sourceId": "lilly-news-releases",
      "sourceName": "Eli Lilly News Releases",
      "status": "failed",
      "startedAt": "2026-10-21T13:11:16.183031194Z",
      "completedAt": "2026-10-21T13:11:16.604908917Z",
      "fetchedCount": 0,
      "newCount": 0,
      "duplicateCount": 0,
      "failedCount": 1,
      "httpStatusClasses": {
        "4xx": 1
      },
      "errorCode": "HTTP_403",
      "nextRetryAt": "2026-10-21T19:11:16.605011889Z"
    },
    {
      "sourceId": "medrxiv-recent",
      "sourceName": "medRxiv",
      "status": "ok",
      "startedAt": "2026-10-21T07:35:09.420535051Z",